{
  "candidate": {
    "environment": {
      "abi_tag": "cpython-311",
      "implementation": "CPython",
      "installed_origin": true,
      "native_origin": "lib/python3.11/site-packages/qwen_mm/_native.abi3.so",
      "numpy": "2.4.6",
      "package_origin": "lib/python3.11/site-packages/qwen_mm/__init__.py",
      "platform": "macOS-26.5.2-arm64-arm-64bit",
      "python": "3.11.15"
    },
    "gate_invocation_identity": {
      "entrypoint": "qwen_mm:Processor",
      "forbidden_modules": [
        "PIL",
        "torch",
        "torchvision",
        "transformers",
        "qwen_vl_utils"
      ],
      "python_isolated_mode": true
    },
    "runtime_identity": {
      "native_artifact_sha256": "94422cf4e8792773777ae615089ae6593f5a2113dc97ab2622297770d9e0016a",
      "native_module": "qwen_mm._native",
      "package": "qwen_mm",
      "package_artifact_sha256": "f947311a8f7b462cf26d26395f1d09445955fb5fc5d2897648754b966bfc4a16",
      "version": "0.1.0"
    },
    "wheel": {
      "bound_runtime_identity": {
        "native_artifact_sha256": "94422cf4e8792773777ae615089ae6593f5a2113dc97ab2622297770d9e0016a",
        "native_module": "qwen_mm._native",
        "package": "qwen_mm",
        "package_artifact_sha256": "f947311a8f7b462cf26d26395f1d09445955fb5fc5d2897648754b966bfc4a16",
        "version": "0.1.0"
      },
      "build_command": "maturin build --locked",
      "filename": "qwen_mm-0.1.0-cp311-abi3-macosx_11_0_arm64.whl",
      "sha256": "854b5f9bf5639cf954f2653d510833f81c5be1db8eb66089737ad2ac0d7fef69",
      "tag": "cp311-abi3-macosx_11_0_arm64"
    }
  },
  "comparator": {
    "diagnostic_fields": [
      "maximum_absolute_error",
      "maximum_ulp_error",
      "rmse",
      "absolute_error_percentiles",
      "count_over_threshold",
      "first_difference"
    ],
    "final_lossy_atol": 0.007844090461730957,
    "final_strict_atol": 1e-06,
    "policy_id": "qwen-mm-compat-v1-comparison",
    "prepared_lossless_absolute_byte_error_max": 0,
    "prepared_lossy_absolute_byte_error_max": 1
  },
  "contract_id": "qwen-mm-compat-v1",
  "created_at": "2026-08-03T17:02:06.339794+00:00",
  "fixture_authentication": [
    {
      "candidate_executed": false,
      "case_id": "rule:round-half-0-even",
      "classification": "helper-only oracle fixture; installed-boundary mapping is recorded separately",
      "issues": [],
      "passed": true,
      "profile": "both",
      "tier": "reference-fixture-authentication"
    },
    {
      "candidate_executed": false,
      "case_id": "rule:round-half-2-even",
      "classification": "helper-only oracle fixture; installed-boundary mapping is recorded separately",
      "issues": [],
      "passed": true,
      "profile": "both",
      "tier": "reference-fixture-authentication"
    },
    {
      "candidate_executed": false,
      "case_id": "rule:round-half-2-even-down",
      "classification": "helper-only oracle fixture; installed-boundary mapping is recorded separately",
      "issues": [],
      "passed": true,
      "profile": "both",
      "tier": "reference-fixture-authentication"
    },
    {
      "candidate_executed": false,
      "case_id": "rule:round-half-4-even",
      "classification": "helper-only oracle fixture; installed-boundary mapping is recorded separately",
      "issues": [],
      "passed": true,
      "profile": "both",
      "tier": "reference-fixture-authentication"
    },
    {
      "candidate_executed": false,
      "case_id": "rule:resize-default-min-below",
      "classification": "helper-only oracle fixture; installed-boundary mapping is recorded separately",
      "issues": [],
      "passed": true,
      "profile": "both",
      "tier": "reference-fixture-authentication"
    },
    {
      "candidate_executed": false,
      "case_id": "rule:resize-default-min-edge",
      "classification": "helper-only oracle fixture; installed-boundary mapping is recorded separately",
      "issues": [],
      "passed": true,
      "profile": "both",
      "tier": "reference-fixture-authentication"
    },
    {
      "candidate_executed": false,
      "case_id": "rule:resize-explicit-min",
      "classification": "helper-only oracle fixture; installed-boundary mapping is recorded separately",
      "issues": [],
      "passed": true,
      "profile": "both",
      "tier": "reference-fixture-authentication"
    },
    {
      "candidate_executed": false,
      "case_id": "rule:resize-explicit-max",
      "classification": "helper-only oracle fixture; installed-boundary mapping is recorded separately",
      "issues": [],
      "passed": true,
      "profile": "both",
      "tier": "reference-fixture-authentication"
    },
    {
      "candidate_executed": false,
      "case_id": "rule:resize-exact-budget",
      "classification": "helper-only oracle fixture; installed-boundary mapping is recorded separately",
      "issues": [],
      "passed": true,
      "profile": "both",
      "tier": "reference-fixture-authentication"
    },
    {
      "candidate_executed": false,
      "case_id": "rule:aspect-ratio-200",
      "classification": "helper-only oracle fixture; installed-boundary mapping is recorded separately",
      "issues": [],
      "passed": true,
      "profile": "both",
      "tier": "reference-fixture-authentication"
    },
    {
      "candidate_executed": false,
      "case_id": "rule:aspect-ratio-over-200",
      "classification": "helper-only oracle fixture; installed-boundary mapping is recorded separately",
      "issues": [],
      "passed": true,
      "profile": "both",
      "tier": "reference-fixture-authentication"
    },
    {
      "candidate_executed": false,
      "case_id": "rule:explicit-dimensions-paired",
      "classification": "helper-only oracle fixture; installed-boundary mapping is recorded separately",
      "issues": [],
      "passed": true,
      "profile": "both",
      "tier": "reference-fixture-authentication"
    },
    {
      "candidate_executed": false,
      "case_id": "rule:explicit-dimensions-unpaired",
      "classification": "helper-only oracle fixture; installed-boundary mapping is recorded separately",
      "issues": [],
      "passed": true,
      "profile": "both",
      "tier": "reference-fixture-authentication"
    },
    {
      "candidate_executed": false,
      "case_id": "rule:image-placeholder-count",
      "classification": "helper-only oracle fixture; installed-boundary mapping is recorded separately",
      "issues": [],
      "passed": true,
      "profile": "both",
      "tier": "reference-fixture-authentication"
    },
    {
      "candidate_executed": false,
      "case_id": "rule:checked-product-largest",
      "classification": "helper-only oracle fixture; installed-boundary mapping is recorded separately",
      "issues": [],
      "passed": true,
      "profile": "both",
      "tier": "reference-fixture-authentication"
    },
    {
      "candidate_executed": false,
      "case_id": "rule:checked-product-overflow",
      "classification": "helper-only oracle fixture; installed-boundary mapping is recorded separately",
      "issues": [],
      "passed": true,
      "profile": "both",
      "tier": "reference-fixture-authentication"
    }
  ],
  "inputs": [
    {
      "path": "Cargo.lock",
      "sha256": "1ef7f1d81b7e6f140fc45868d10870e10ce2aa92c7fc58fd2f0ec7253d847ce2"
    },
    {
      "path": "Cargo.toml",
      "sha256": "0b65b2c5bdce6f0b6e2b3606a2416d21a40d5387f345e353ffced390a8b4bdae"
    },
    {
      "path": "Makefile",
      "sha256": "9c29c2e904e33ca7553885da1cb47c76f757ff038c6e68c5b7f5b766281e33d5"
    },
    {
      "path": "crates/qwen-mm-core/Cargo.toml",
      "sha256": "885efbefc009d645dae182a0d90bc272ef417ce246cb829c22afd3d86b832c25"
    },
    {
      "path": "crates/qwen-mm-core/src/error.rs",
      "sha256": "95613de6f95faa75b3c667d72196e50f04cc4878f2d44e14bf2e31b0e363f29c"
    },
    {
      "path": "crates/qwen-mm-core/src/geometry.rs",
      "sha256": "f5c712dcf7f97e55ecc6bea8c8cd1d898d3e5f60c61fa53c1254c802f9961174"
    },
    {
      "path": "crates/qwen-mm-core/src/lib.rs",
      "sha256": "9721a44082bc8f6747f1a3d11b882fd0be7607dee5425280c23c8002291cc2f0"
    },
    {
      "path": "crates/qwen-mm-core/src/limits.rs",
      "sha256": "f67640fc840f89137819fbf36d59cf2fd16c5bde25b4f28079493cd76713e19c"
    },
    {
      "path": "crates/qwen-mm-core/src/media.rs",
      "sha256": "2d73e873df11207f496ee80360688ae7a08049b5ea2f3e1140144f9c7b86efb7"
    },
    {
      "path": "crates/qwen-mm-core/src/media_conformance_tests.rs",
      "sha256": "ce071cc949d811e34a00a0c14317cea65e9f46e6afb76841ee56fb74a62dbf90"
    },
    {
      "path": "crates/qwen-mm-core/src/observability.rs",
      "sha256": "8b13e78769646b82c8db4002a61eec91717f87397717170cba7228aaf69f898e"
    },
    {
      "path": "crates/qwen-mm-core/src/output.rs",
      "sha256": "c37108beb3af617dcb50bc99ebae95e1cbffc00cbcad10d3527dc26d6512ad9e"
    },
    {
      "path": "crates/qwen-mm-core/src/patchify.rs",
      "sha256": "70672a5e073e1d2729f64bfd5b2f7ea4f7a752d04db4487c3d694676c89048ff"
    },
    {
      "path": "crates/qwen-mm-core/src/patchify_conformance_tests.rs",
      "sha256": "ddfcbc76b5168248f23446dbc85d8ab14d29ef9aaadf2b4f02450536a8a83c48"
    },
    {
      "path": "crates/qwen-mm-core/src/processor.rs",
      "sha256": "cecef350e9900e813d34801412ff6a700da2d0b144e702f7159e51dd0e829822"
    },
    {
      "path": "crates/qwen-mm-core/src/profile.rs",
      "sha256": "8b78b0edd8646c270d7777550063b99cfc350d604e5f4578d13157ae0d7bff46"
    },
    {
      "path": "crates/qwen-mm-core/src/request.rs",
      "sha256": "ece4ecc273822f423756ee8916e5c4ef78bbc2f70c316a99968cee56b0103526"
    },
    {
      "path": "crates/qwen-mm-core/src/resize.rs",
      "sha256": "9910e7d62d85bab8115f67f82f085120ee6ace8dde2c6550ccc00612ecadd5ae"
    },
    {
      "path": "crates/qwen-mm-core/src/text.rs",